{
  "experimentId": "exp04_standard_solution",
  "experimentVersion": "1.1.0",
  "assessmentVersion": "1.0.0",
  "mode": "guided",
  "guidanceLevel": "beginner",
  "locale": "si",
  "preLab": {
    "answers": {
      "q2": "සාන්ද්‍රණය = ප්‍රමාණය ÷ පරිමාව"
    },
    "prediction": "clear solution",
    "acknowledgedSafety": [
      "read_procedure",
      "goggles",
      "no_food_drink",
      "closed_shoes",
      "hair_restrained",
      "report_incidents"
    ]
  }
}
